Ray-Ban Clubmaster Tortoise Arista 51mm Sunglasses,RB3016-W0366-51,$82.65,Out of Stock,"",Black Friday Sale
Ray-ban Clubmaster Ebony Arista Sunglasses Rb3016w0365-51 In Black,Rb3016-W0365-51,$82.99,Out of Stock,"",Black Friday Sale
Montblanc Meisterstuck Heritage Perpetual Calendar Unisex Watch,110715,"$7,350.00",In Stock.,Free Shipping,Black Friday Sale  Exp. 11/27
Astor Silver-tone Buckle Bangle Bracelet,MKJ1820040,$51.99,Ships In 1 - 2 Weeks.,$5.99 Shipped,Black Friday Sale
Open Box - Ray-Ban Large Aviator Polarized Arista Green Lens Sunglasses,RB3025-001/58-58,$132.89,Out of Stock,"",""
Ray-Ban Justin Classic Brown Gradient Sunglasses,RB4165-710/13-55,$71.67,In Stock.,$5.99 Shipped,FLASH SALE - EXP. 11/29
Stellassa Pink Dial Ladies Casual Watch,OT10,$67.50,Out of Stock,"",""
Slake Deluxe Beige Bracelet,5037392,$49.65,In Stock.,$5.99 Shipped,"FREE DOMESTIC SHIPPING  WITH CODE ""FASTSHIP"""
Attract Round Ring - Size 7,5032921,$74.07,In Stock.,$5.99 Shipped,""
Abstract Nude Pendant,5046999,$135.00,In Stock.,Free Shipping,""
Abstract Pendant,5032771,$135.00,In Stock.,Free Shipping,""
Medium Stone Bangle - Rose Gold,5032850,$85.88,In Stock.,$5.99 Shipped,"FREE DOMESTIC SHIPPING  WITH CODE ""FASTSHIP"""
"",5032904,$49.65,Ships In 2 - 3 Weeks.,$5.99 Shipped,Black Friday Sale
Rice Siam Set - Necklace And Earrings,5034157,$84.99,In Stock.,$5.99 Shipped,Black Friday Sale
Mini Bangle Bracelet,5032845,$85.88,In Stock.,$5.99 Shipped,"FREE DOMESTIC SHIPPING  WITH CODE ""FASTSHIP"""
Bound Bracelet,5080042,$99.99,Ships In 2 - 3 Weeks.,$5.99 Shipped,"FREE DOMESTIC SHIPPING  WITH CODE ""FASTSHIP"""
Swan Bangle,5083133,$107.44,In Stock.,Free Shipping,Black Friday Sale
Slake Black Deluxe Bracelet,5089699,$52.44,In Stock.,$5.99 Shipped,Black Friday Sale
Botanic Earring Set,5071152,$39.20,In Stock.,$5.99 Shipped,""
Swan Gold-tone Mini Pierced Earrings,5083132,$56.56,In Stock.,$5.99 Shipped,Black Friday Sale
Stone Medium Pendant,5069726,$98.13,In Stock.,$5.99 Shipped,Black Friday Sale
Slake Nude Bracelet,5043495,$49.65,In Stock.,$5.99 Shipped,"FREE DOMESTIC SHIPPING  WITH CODE ""FASTSHIP"""
Pebble Pendant - Rhodium,5079660,$111.75,In Stock.,Free Shipping,""
Bolt Pierced Earrings,5081366,$43.18,Ships In 2 - 3 Weeks.,$5.99 Shipped,Black Friday Sale
Admirals Cup Deep Dive Automatic Black Dial Men's Watch 947950860371AN16,5086037,"$6,526.32",Out of Stock,"",""
Crystalline Stardust Pen - Silver,5064408,$28.00,In Stock.,$5.99 Shipped,""
Stardust Vintage Rose Double Bracelet,5089853,$58.99,Ships In 2 - 3 Weeks.,$5.99 Shipped,Black Friday Sale
Crystalline Stardust Pen - Rose Gold-Plated,5064409,$28.00,Ships In 2 - 3 Weeks.,$5.99 Shipped,""
Stardust Black Bracelet,5102552,$43.17,In Stock.,$5.99 Shipped,Black Friday Sale
Baron Bracelet,5074352,$166.12,Ships In 2 - 3 Weeks.,Free Shipping,Black Friday Sale
Biography Pendant,5071176,$83.13,In Stock.,$5.99 Shipped,Black Friday Sale
Baron Necklace,5074348,$107.44,In Stock.,Free Shipping,Black Friday Sale
Baron Pierced Earrings,5074350,$99.99,In Stock.,$5.99 Shipped,"FREE DOMESTIC SHIPPING  WITH CODE ""FASTSHIP"""
Believe Rhodium-Plated Pendant,5007830,$54.38,Ships In 2 - 3 Weeks.,$5.99 Shipped,Black Friday Sale
Stardust Grey Bracelet,5102550,$43.18,In Stock.,$5.99 Shipped,"FREE DOMESTIC SHIPPING  WITH CODE ""FASTSHIP"""
Stardust Pink Double Bracelet,5102556,$56.64,In Stock.,$5.99 Shipped,"FREE DOMESTIC SHIPPING  WITH CODE ""FASTSHIP"""
Rayban Folding Wayfare Black Plastic 50mm Men's Sunglasses,RB4105-601/58-50,$109.00,Out of Stock,"",Black Friday Sale
T24 Series Black Dial Chronograph Polyurethane Men's Watch,24-305,$185.00,Out of Stock,"",4th OF JULY SALE
Stardust Bracelet - Medium,5089839,$42.50,In Stock.,$5.99 Shipped,Black Friday Sale
Edith Bangle,1808935,$99.99,In Stock.,$5.99 Shipped,Black Friday Sale
Tennis Bracelet 1791305,1791305,$85.88,In Stock.,$5.99 Shipped,"FREE DOMESTIC SHIPPING  WITH CODE ""FASTSHIP"""
Emily Bracelet 1808960,1808960,$69.06,In Stock.,$5.99 Shipped,"FREE DOMESTIC SHIPPING  WITH CODE ""FASTSHIP"""
Angelic Gold-Plated Pierced Earrings,1081941,$53.93,In Stock.,$5.99 Shipped,Black Friday Sale
Angelic Pierced Earrings,1081942,$56.12,In Stock.,$5.99 Shipped,Black Friday Sale
Brilliant Crystal Rhodium Solitaire Necklace and Earrings Set,1807339,$85.88,In Stock.,$5.99 Shipped,Black Friday Sale
Stardust Black Double Bracelet,5102553,$56.64,Ships In 2 - 3 Weeks.,$5.99 Shipped,"FREE DOMESTIC SHIPPING  WITH CODE ""FASTSHIP"""
Angelic Pierced Earrings,5112163,$56.12,In Stock.,$5.99 Shipped,Black Friday Sale
Angelic All-Around Necklace,5117703,$166.12,In Stock.,Free Shipping,Black Friday Sale
Cadmia Pendant,5117701,$83.13,In Stock.,$5.99 Shipped,Black Friday Sale
Circle Heart Pendant,5113776,$62.59,In Stock.,$5.99 Shipped,Black Friday Sale
Circle Heart Pendant - Rose Gold,5127999,$66.75,In Stock.,$5.99 Shipped,""
Crocus Short Pendant,5118732,$69.06,Ships In 2 - 3 Weeks.,$5.99 Shipped,Black Friday Sale
Creativity Silver-Tone Ring - Size 8,5139654,$85.88,In Stock.,$5.99 Shipped,Black Friday Sale
Creativity Rose Gold-Tone Ring - Size 8,5139656,$85.88,Ships In 2 - 3 Weeks.,$5.99 Shipped,Black Friday Sale
Silver-Tone Attract Set,5113468,$85.88,In Stock.,$5.99 Shipped,"FREE DOMESTIC SHIPPING  WITH CODE ""FASTSHIP"""
Ray-Ban Aviator Metal Matte Gold Frame Crystal Blue Mirrored Lenses Large Sunglasses,5112175,$95.00,In Stock.,$5.99 Shipped,FLASH SALE - EXP. 11/29
Slake Light Green Deluxe Bracelet,5120581,$49.65,In Stock.,$5.99 Shipped,"FREE DOMESTIC SHIPPING  WITH CODE ""FASTSHIP"""
Slake White Opal Deluxe Bracelet,5120520,$52.44,In Stock.,$5.99 Shipped,Black Friday Sale
Slake Fuchsia Deluxe Bracelet,5124127,$51.75,Ships In 2 - 3 Weeks.,$5.99 Shipped,""
Cupid Rose Pendant,5118813,$85.88,In Stock.,$5.99 Shipped,Black Friday Sale
Stardust Pink Double Bracelet,5120152,$56.12,In Stock.,$5.99 Shipped,Black Friday Sale
Christie Necklace,5118942,$60.63,In Stock.,$5.99 Shipped,Black Friday Sale
Crocus Heart Pendant,5128098,$60.63,In Stock.,$5.99 Shipped,Black Friday Sale
Stardust Light Blue Double Bracelet,5139746,$56.12,Ships In 2 - 3 Weeks.,$5.99 Shipped,"FREE DOMESTIC SHIPPING  WITH CODE ""FASTSHIP"""
Slake Black 2 in 1 Bracelet,5142963,$52.44,In Stock.,$5.99 Shipped,Black Friday Sale
Slake Black Deluxe Bracelet,5141350,$49.65,Ships In 2 - 3 Weeks.,$5.99 Shipped,Black Friday Sale
Stardust Gradient Bracelet,5151888,$45.56,Ships In 2 - 3 Weeks.,$5.99 Shipped,Black Friday Sale
Attract Light Pierced Earrings,5142721,$69.99,In Stock.,$5.99 Shipped,""
Swan Mini Pierced Earrings,5144289,$60.00,In Stock.,$5.99 Shipped,""
Attract Blue Light Dual Set,5166045,$98.13,Ships In 2 - 3 Weeks.,$5.99 Shipped,Black Friday Sale
Duo Star Set,5140839,$119.20,In Stock.,Free Shipping,""
Delta Medium Necklace,5140123,$89.99,In Stock.,$5.99 Shipped,Black Friday Sale
Duo Heart Small Pendant,5139473,$66.75,In Stock.,$5.99 Shipped,""
Attract Dual Light Necklace,5142719,$74.25,In Stock.,$5.99 Shipped,""
Duo Heart Medium Pendant,5169393,$93.75,In Stock.,$5.99 Shipped,"FREE DOMESTIC SHIPPING  WITH CODE ""FASTSHIP"""
Duo Evil Eye Pendant,5172560,$74.25,Ships In 2 - 3 Weeks.,$5.99 Shipped,""
Deluxe Black Bracelet,5021032,$52.44,Ships In 2 - 3 Weeks.,$5.99 Shipped,Black Friday Sale
Slake Deluxe Gray Bracelet,5021033,$52.44,In Stock.,$5.99 Shipped,Black Friday Sale
Slake Crystal Gray Bracelet,5181989,$52.44,In Stock.,$5.99 Shipped,""
Duo Heart Bangle,5169396,$74.99,In Stock.,$5.99 Shipped,""
Crystal Pave Gold-Tone Small Hoop Earrings,MKJ4400710,$51.99,Out of Stock,"",Black Friday Sale
Crystal Pave Silver-Tone Small Hoop Earrings,MKJ4401040,$52.99,Out of Stock,"","FREE DOMESTIC SHIPPING  WITH CODE ""FASTSHIP"""
Crystal Silver-tone Medium Stud Earrings,MKJ1093040,$38.99,Out of Stock,"",Black Friday Sale
Gold-tone Open Hoop Womens Earrings,MKJ3654710,$62.99,Out of Stock,"",Black Friday Sale
Slake Black Bracelet,1179237,$49.99,In Stock.,$5.99 Shipped,Black Friday Sale
Slake Denim Blue Rock Bracelet,5120235,$51.75,Ships In 2 - 3 Weeks.,$5.99 Shipped,""
Stardust Light Blue Double Bracelet,5120149,$56.12,In Stock.,$5.99 Shipped,"FREE DOMESTIC SHIPPING  WITH CODE ""FASTSHIP"""
Gold-plated Circle Pendant 1081977,1081977,$62.59,In Stock.,$5.99 Shipped,Black Friday Sale
Stardust Beige Double Bracelet 5102549,5102549,$56.12,In Stock.,$5.99 Shipped,"FREE DOMESTIC SHIPPING  WITH CODE ""FASTSHIP"""
Classic Manufacture White Dial 18K Yellow Gold Automatic Men's Watch,12890,"$9,728.40",Ships In 1 - 2 Weeks.,Free Shipping,Summer Sale
No. 1 Diamond Steel Black Ladies Watch,11402,"$3,083.33",Out of Stock,"",""
Retro Traveler Chronograph Red Dial Stainless Steel Men's Watch,2866,$76.96,Out of Stock,"",""
Dual Time Zone Black Dial Rose Gold Leather Men's Watch,2865,"$17,406.60",Ships In 1 - 2 Weeks.,Free Shipping,""
Pro Diver Silver Dial Stainless Steel Ladies Watch,7569,$68.17,Out of Stock,"",""
DeVille Prestige Mother of Pearl Dial Steel and 18k Yellow Gold Ladies Watch,7571,"$4,725.00",Out of Stock,"",LABOR DAY SALE
Montblanc Ballpoint Pen Starwalker Mystery Laser-engraved Black Lacquer,104227,$289.53,Ships In 2 - 3 Weeks.,Free Shipping,Black Friday Sale
MontBlanc Starwalker Black Mystery Fineliner Rollerball Pen,104226,$348.27,In Stock.,Free Shipping,Black Friday Sale  Exp. 11/27
Midnight Black Resin Fineliner,105656,$215.00,In Stock.,Free Shipping,Black Friday Sale  Exp. 11/27
Chambers Rose Dial Rose Gold-tone Ladies Watch,8486,$79.99,Out of Stock,"",Black Friday Sale
Slake Beige Dot Bracelet,5201121,$51.75,In Stock.,$5.99 Shipped,""
Slake Dark Blue Dot Bracelet,5201118,$51.75,Ships In 2 - 3 Weeks.,$5.99 Shipped,""
Slake Gray Dot Bracelet,5201119,$51.75,Ships In 2 - 3 Weeks.,$5.99 Shipped,""
Attract Heart Hoop Pierced Earrings,5188403,$63.20,In Stock.,$5.99 Shipped,""
Annual Edition 2016 Christmas Ornament,5180210,$64.99,In Stock.,$5.99 Shipped,""
Cupid Bangle,5195170,$119.20,In Stock.,Free Shipping,""
Swarvoski Slake Dark Blue Alcantara Bracelet,5194200,$54.99,In Stock.,$5.99 Shipped,""
Slake Aqua Dot Bracelet,5201117,$51.75,In Stock.,$5.99 Shipped,""
Slake Purple Dot Bracelet,5201123,$51.75,In Stock.,$5.99 Shipped,""
Slake Black Dot Bracelet,5201120,$51.75,Ships In 2 - 3 Weeks.,$5.99 Shipped,""
Slake Mauve Dot Bracelet,5201122,$54.99,In Stock.,$5.99 Shipped,""
Even Bracelet,5190063,$93.75,In Stock.,$5.99 Shipped,""
T-Touch Racing Stainless Steel Men's Watch,5201105,$467.70,Out of Stock,"",""
Slake Dot Pierced Earring Jackets,5201102,$52.44,In Stock.,$5.99 Shipped,Black Friday Sale
Slake Dot Pierced Earring Jackets,5201104,$52.44,In Stock.,$5.99 Shipped,Black Friday Sale
Harley Pierced Earrings Set,5181485,$47.20,In Stock.,$5.99 Shipped,""
Exist Hoop Earrings,5182322,$89.99,In Stock.,$5.99 Shipped,Black Friday Sale
Cupid Small Necklace,5198939,$69.99,In Stock.,$5.99 Shipped,""
Duo Infinity Pendant,5182086,$66.19,In Stock.,$5.99 Shipped,Black Friday Sale
Duo Sunflower Pendant,5213245,$69.99,In Stock.,$5.99 Shipped,""
Eden Ladies Necklace,5182028,$109.99,In Stock.,Free Shipping,""
Even Pendant,5181453,$74.25,In Stock.,$5.99 Shipped,""
Attract Light Ladies Necklace,5181007,$74.99,In Stock.,$5.99 Shipped,""
Attract Heart Set Ladies,5218461,$95.00,In Stock.,$5.99 Shipped,""
Cupid Set,5198937,$100.00,In Stock.,$5.99 Shipped,""
Dear Small Set,5156820,$109.99,In Stock.,Free Shipping,""
Harley Earlobe Earrings,5193623,$52.44,In Stock.,$5.99 Shipped,Black Friday Sale
Alpha Medium Necklace,5197483,$94.99,In Stock.,$5.99 Shipped,""
Alpha Medium Necklace,5210287,$94.99,In Stock.,$5.99 Shipped,""
Creativity Circle Pendant,5198686,$59.31,In Stock.,$5.99 Shipped,Black Friday Sale
Edify Medium Rose Gold-Tone Necklace,5197179,$99.99,In Stock.,$5.99 Shipped,""
Small Exist Pendant,5188401,$66.19,In Stock.,$5.99 Shipped,Black Friday Sale
Coupole Classic Men's Watch,64022,$799.00,In Stock.,Free Shipping,FLASH SALE - EXP. 11/25
Originals Gent Black Suit Watch,ITG,$45.00,Out of Stock,"",""
Stardust Grey Double Bracelet,5089840,$58.99,Ships In 2 - 3 Weeks.,$5.99 Shipped,Black Friday Sale
J12 Automatic Black Diamond Dial Black Ceramic Men's Watch,H202,"$35,995.00",Ships In 1 Day.,Free Shipping,Black Friday Sale
Explore Pendant,5181465,$93.75,In Stock.,$5.99 Shipped,""
Explore Heart Pendant,5181467,$89.99,In Stock.,$5.99 Shipped,Black Friday Sale
Small Exist Pendant,5190024,$66.19,In Stock.,$5.99 Shipped,Black Friday Sale
Explore Heart Pendant,5190269,$89.99,In Stock.,$5.99 Shipped,Black Friday Sale
Stella Multi-Function Stainless Steel Ladies Watch,S305,$75.00,Out of Stock,"",""
Bella Clear Crystal Pierced Earrings,883551,$59.00,In Stock.,$5.99 Shipped,Black Friday Sale
Bella Golden Shadow Pierced Earrings 901640,901640,$56.99,In Stock.,$5.99 Shipped,"FREE DOMESTIC SHIPPING  WITH CODE ""FASTSHIP"""
50s Presidents Watch Mechanical Black Dial Black Leather Men's Watch,1106512,"$7,101.25",Ships In 1 Day.,Free Shipping,""
Somerset Medium Hoop Pierced Earrings,1172369,$60.63,In Stock.,$5.99 Shipped,Black Friday Sale
Summerset Hoop Pierced Earrings,1172374,$35.99,In Stock.,$5.99 Shipped,Black Friday Sale
Circle Pierced Earrings,5007750,$53.53,In Stock.,$5.99 Shipped,Black Friday Sale
Swarovksi Gillian Necklace,678189,$69.06,In Stock.,$5.99 Shipped,Black Friday Sale
Rhodium Pave Circle Pendant,681251,$62.59,In Stock.,$5.99 Shipped,Black Friday Sale
Pave Small Cross Pendant,956722,$53.53,In Stock.,$5.99 Shipped,Black Friday Sale
Lavender Pendant,1039065,$69.06,In Stock.,$5.99 Shipped,Black Friday Sale
Mozart Heart Pendant Necklace,1071200,$56.12,In Stock.,$5.99 Shipped,Black Friday Sale
Angelic Pendant,1081938,$69.06,In Stock.,$5.99 Shipped,Black Friday Sale
Solitaire Pendant Necklace,1800045,$62.59,In Stock.,$5.99 Shipped,Black Friday Sale
Exact Pendant,5194452,$74.25,In Stock.,$5.99 Shipped,""
Silver Plated Marly After Dinner Tea,38004,$59.15,Ships In 8 - 12 Weeks.,$5.99 Shipped,""
La Dona de Cartier Ladies Watch,40020,"$10,495.00",Out of Stock,"",""
"",46020,$528.50,In Stock.,Free Shipping,""
P'6930 Chronograph Automatic Black Dial Black Rubber Men's Watch,46120,"$2,799.00",Out of Stock,"",Black Friday Sale
Cedar Street Shoulder Bag - Elissa Black,46220,$244.20,Out of Stock,"",""
St Tropez Mother of Pearl Diamond Dial Ladies Watch,CS520,$699.00,Ships In 3 - 5 Days.,Free Shipping,""
Every Pendant,5195164,$94.99,In Stock.,$5.99 Shipped,""
Cedar Street Maise Leather Shoulder Bag - Black,PxRU5490001,$244.00,In Stock.,Free Shipping,Black Friday Sale
Crystal Bangle,5250023,$71.20,In Stock.,$5.99 Shipped,""
Iconic Swan Pierced Earrings,5193949,$79.20,Out of Stock,"",""
Funk Necklace and Earring Set,5253052,$94.99,In Stock.,$5.99 Shipped,""
Funk Necklace,5241271,$54.99,In Stock.,$5.99 Shipped,""
Big Bang Black Dial 18kt Rose Gold Diamond Men's Watch 301PX1180PX3704,PX3,"$79,416.00",Ships In 2 - 3 Weeks.,Free Shipping,""
Aviator Flash Blue Gradient Flash Sunglasses,RB3025-002/4O,$92.00,In Stock.,$5.99 Shipped,FLASH SALE - EXP. 11/29
Aviator Gradient Light Blue Gradient Sunglasses Rb3025-0033F-5814,RB3025-003/3F,$89.00,In Stock.,$5.99 Shipped,FLASH SALE - EXP. 11/29
Ray-Ban Aviator Silver Mirror Lens Sunglasses RB3025-003-40-62,RB3025-003/40,$89.99,Out of Stock,"",Black Friday Sale
Ray-Ban Aviator Classic Sunglasses - Brown,RB3025-001/33,$79.99,Out of Stock,"",Black Friday Sale
Aviator Polarized Grey Mirror Sunglasses,RB8313-002/K7,$139.99,Out of Stock,"",Black Friday Sale
Ray-Ban Aviator Classic Sunglasses - Polarized Green G -15,RB3025-004/58,$108.53,In Stock.,Free Shipping,FLASH SALE - EXP. 11/29
Ray-Ban 67 mm Pilot Sunglasses - Grey Gradient,RB3386-003/8G,$89.50,In Stock.,$5.99 Shipped,FLASH SALE - EXP. 11/29
Aviator Arista Green with Mirrored Lenses 58 mm Sunglasses,RB3025-112/19,$95.00,In Stock.,$5.99 Shipped,FLASH SALE - EXP. 11/29
Ray-Ban Pilot Grey Mirror Lens Sunglasses,RB3449-003/8G,$89.50,Out of Stock,"",Black Friday Sale
Ray-Ban Cockpit Light Brown Gradient Lens Sunglasses,RB3362-001/51,$84.99,Out of Stock,"",Black Friday Sale
Ray-Ban Cockpit Green Classic G-15 Sunglasses,RB3362-004,$84.99,Out of Stock,"",Black Friday Sale
Ray-Ban Cockpit Light Brown Gradient Lens Sunglasses,RB3362-001,$84.99,Out of Stock,"",Black Friday Sale
Ray-Ban Wayfarer Tortoise Frame Folding Sunglasses,RB4105-710/51,$88.32,In Stock.,$5.99 Shipped,FLASH SALE - EXP. 11/29
Ray-Ban Wayfarer Tortoise Frame Folding Sunglasses,RB4105-710,$88.32,In Stock.,$5.99 Shipped,FLASH SALE - EXP. 11/29
Ray-Ban Wayfarer Blue Frame Folding Sunglasses,RB4105-602017,$88.99,Out of Stock,"",Black Friday Sale
Ray-Ban Wayfarer Black Frame Folding Sunglasses,RB4105-601/58-54,$113.16,Out of Stock,"",Black Friday Sale
New Wayfarer Bicolor Grey Gradient Sunglasses,RB2132-619171,$84.99,In Stock.,$5.99 Shipped,FLASH SALE - EXP. 11/29
New Wayfarer Green Classic G-15 Sunglasses RB2132 6052,RB2132-6052,$74.99,Out of Stock,"",Black Friday Sale
Ray-Ban Round Blue Gradient Flash Sunglasses,RB3447-002/4O,$96.60,Out of Stock,"",Black Friday Sale
Rayban Boyfriend Gradient Silver Unisex Sunglasses,RB4147-601/32,$82.65,Out of Stock,"",Black Friday Sale
Seamaster Ploprof White Dial White Rubber Men's Watch 22432552104001,24-325,"$4,995.00",Out of Stock,"",Black Friday Sale
Crystaldust Golden Crystal Bangle,5237763,$71.20,Ships In 2 - 3 Weeks.,$5.99 Shipped,""
New Wayfarer Green Gradient Lens 55mm Men's Sunglasses RB2140-1157-50,RB2140-1157,$84.99,Out of Stock,"",Black Friday Sale
Ray-Ban Original Wayfarer Denim Green Mirror Sunglasses,RB2140-11912X-50,$126.15,In Stock.,Free Shipping,""
Original Wayfarer Classics Polarized Brown Classic B-15 Sunglasses,RB2140-902/57-50,$114.99,Out of Stock,"",Black Friday Sale
Clubmaster Classic Polarized Green Classic G-15 Sunglasses,RB3016-901/58-49,$109.99,Out of Stock,"",Black Friday Sale
Aviator Polarized Blue / Grey Gradient Sunglasses,RB3025-001/78-58,$109.00,Out of Stock,"",Black Friday Sale
Aviator Polarized Lilac Flash Sunglasses,RB3025-167/1R-58,$109.99,Out of Stock,"",Black Friday Sale
Aviator Classic Polarized Green Classic G-15 Sunglasses,RB3025-004-58-62,$109.00,Out of Stock,"",Black Friday Sale
Dynamic Pendant,5266940,$93.75,In Stock.,$5.99 Shipped,""
